{
  "$schema": "./p2-pkg-04-inventory.schema.json",
  "version": "1.0",
  "package": "P2-04",
  "lastVerified": "2026-09-04",
  "entries": [
    {
      "id": "DS-01",
      "file": "CRM-Client/src/AppLayout.vue",
      "symbol": "AppLayout",
      "category": "token",
      "current": "局部布局样式与兼容 Token 并存",
      "target": "新增样式优先使用语义 CSS variable/Tailwind class",
      "exception": false,
      "batch": "P2-04-05",
      "risk": "theme-regression",
      "verification": "npm run test:unit -- --run tests/components/AppLayout.spec.ts; npm run type-check; 亮暗色与侧栏回归",
      "status": "implemented-compatible",
      "lastVerified": "2026-09-04",
      "owner": "frontend-platform"
    },
    {
      "id": "DS-02",
      "file": "CRM-Client/src/views/SalesDashboard.vue",
      "symbol": "trend series colors",
      "category": "raw-color",
      "current": "图表序列颜色使用数据可视化色板",
      "target": "UI 外壳迁移到语义 Token，序列色保留登记例外",
      "exception": true,
      "batch": "P2-04-05",
      "risk": "visualization-regression",
      "verification": "亮暗色、图表 tooltip、图例回归",
      "status": "exception-registered",
      "lastVerified": "2026-09-04",
      "owner": "frontend-platform"
    },
    {
      "id": "DS-03",
      "file": "CRM-Client/src/components/crmwolf/MetricCard.vue",
      "symbol": "MetricCard styles",
      "category": "token",
      "current": "卡片存在页面级视觉实现",
      "target": "边框、背景、阴影和 tone 使用语义入口",
      "exception": false,
      "batch": "P2-04-05",
      "risk": "theme-regression",
      "verification": "npm run type-check; npx eslint src/components/crmwolf/MetricCard.vue --max-warnings=0; 亮暗色与 reduced-motion 回归",
      "status": "implemented-compatible",
      "lastVerified": "2026-09-04",
      "owner": "frontend-platform"
    },
    {
      "id": "DS-04",
      "file": "CRM-Client/src/components/crmwolf/TopBarTabs.vue",
      "symbol": "TopBarTabs",
      "category": "token",
      "current": "导航状态样式与兼容 Token 混用",
      "target": "激活、hover、focus 使用语义 Token",
      "exception": false,
      "batch": "P2-04-05",
      "risk": "navigation-regression",
      "verification": "npm run type-check; npx eslint src/components/crmwolf/TopBarTabs.vue --max-warnings=0; 键盘 Tab/Enter、亮暗色、路由行为回归",
      "status": "implemented-compatible",
      "lastVerified": "2026-09-04",
      "owner": "frontend-platform"
    },
    {
      "id": "DS-05",
      "file": "CRM-Client/src/components/panels/PaymentPlanDetailContent.vue",
      "symbol": "detail loading/error/empty",
      "category": "feedback-state",
      "current": "局部 Skeleton/Empty/Error 组合",
      "target": "复用共享状态配方，保留回款业务动作和文案",
      "exception": false,
      "batch": "P2-04-03/P2-04-05",
      "risk": "detail-flow-regression",
      "verification": "npm run test:unit -- --run tests/components/DataViewStatePanel.spec.ts; npm run type-check; 首次加载、失败重试、空态、登记回款流程",
      "status": "implemented-compatible",
      "lastVerified": "2026-09-04",
      "owner": "frontend-platform"
    },
    {
      "id": "DS-06",
      "file": "CRM-Client/src/components/crmwolf/DataTable.vue",
      "symbol": "viewState/heightStrategy/scrollMode",
      "category": "shared-contract",
      "current": "新旧 API 兼容并存",
      "target": "新代码使用推荐 API，存量兼容参数不删除",
      "exception": false,
      "batch": "P2-04-02/P2-04-06",
      "risk": "list-scroll-regression",
      "verification": "超过 20 条、分页、固定列、移动卡片回归",
      "status": "implemented-compatible",
      "lastVerified": "2026-09-04",
      "owner": "frontend-platform"
    },
    {
      "id": "DS-07",
      "file": "CRM-Client/src/components/StatusBadge.vue",
      "symbol": "STATUS_CONFIG",
      "category": "status-contract",
      "current": "通用生命周期状态映射已存在",
      "target": "未知状态有稳定兜底，调用方不传颜色",
      "exception": false,
      "batch": "P2-04-04",
      "risk": "status-display-regression",
      "verification": "各实体状态、未知状态、亮暗色组件测试",
      "status": "implemented-compatible",
      "lastVerified": "2026-09-04",
      "owner": "frontend-platform"
    },
    {
      "id": "DS-08",
      "file": "CRM-Client/src/components/ApprovalStatusBadge.vue",
      "symbol": "STATUS_CONFIG",
      "category": "approval-status-contract",
      "current": "审批状态保留独立图标和语义",
      "target": "未知状态也不可渲染为空，继续单条审批",
      "exception": false,
      "batch": "P2-04-04",
      "risk": "approval-semantics-regression",
      "verification": "npm run test:unit -- --run tests/components/ApprovalStatusBadge.spec.ts; 审批中心单条操作回归",
      "status": "implemented-compatible",
      "lastVerified": "2026-09-04",
      "owner": "frontend-platform"
    },
    {
      "id": "DS-09",
      "file": "CRM-Client/src/components/ErrorState.vue",
      "symbol": "ErrorState",
      "category": "feedback-state",
      "current": "共享错误展示组件已存在，动作通过 slot 注入",
      "target": "作为详情/设置局部失败的推荐入口",
      "exception": false,
      "batch": "P2-04-03",
      "risk": "accessibility-regression",
      "verification": "role=alert、重试动作、局部失败隔离",
      "status": "implemented-compatible",
      "lastVerified": "2026-09-04",
      "owner": "frontend-platform"
    },
    {
      "id": "DS-10",
      "file": "CRM-Client/src/components/crmwolf/LoadingSkeleton.vue",
      "symbol": "LoadingSkeleton",
      "category": "feedback-state",
      "current": "列表/卡片/表格骨架已存在",
      "target": "明确与原生 Skeleton 的选用边界",
      "exception": false,
      "batch": "P2-04-03/P2-04-06",
      "risk": "layout-shift",
      "verification": "aria-busy、稳定占位、reduced-motion",
      "status": "implemented-compatible",
      "lastVerified": "2026-09-04",
      "owner": "frontend-platform"
    },
    {
      "id": "DS-11",
      "file": "CRM-Client/src/views/AccountSettings.vue",
      "symbol": "account loading/error/empty/ready",
      "category": "feedback-state",
      "current": "账户设置页面自行分支加载、错误和空状态",
      "target": "复用 DataViewStatePanel 状态配方，保留账户资料、密码修改和飞书绑定动作",
      "exception": false,
      "batch": "P2-04-03/P2-04-06",
      "risk": "settings-flow-regression",
      "verification": "npm run test:unit -- --run tests/views/AccountSettings.spec.ts; npm run type-check; 首次加载、失败重试、空态、密码修改和飞书绑定回归",
      "status": "implemented-compatible",
      "lastVerified": "2026-09-04",
      "owner": "frontend-platform"
    },
    {
      "id": "DS-12",
      "file": "CRM-Client/src/components/customer/CustomerOpportunityHoverCard.vue",
      "symbol": "customer opportunity preview loading/error/empty/ready",
      "category": "feedback-state",
      "current": "浮层自行组合 Skeleton、Empty 和失败重试状态",
      "target": "复用 DataViewStatePanel 状态配方，保留浮层预览、选择商机和查看全部动作",
      "exception": false,
      "batch": "P2-04-03/P2-04-06",
      "risk": "hover-preview-regression",
      "verification": "npm run test:unit -- --run tests/components/CustomerOpportunityHoverCard.spec.ts; npm run type-check; 首次打开、加载失败重试、空态、选择商机和查看全部回归",
      "status": "implemented-compatible",
      "lastVerified": "2026-09-04",
      "owner": "frontend-platform",
      "notes": "商机阶段 Badge 的蓝色业务标签样式为已登记例外 DS-EX-003；不属于生命周期状态徽章。"
    }
  ]
}
